Požadavek;Popis;Druh;Kód;Status;Verze;Modely;SortID;Úplný název;Řádek tabulky
Do seznamu technologií uvést potřebné technologie pro integraci;Dodavatel v rámci seznamu využitých technologií a technologií potřebných pro provoz a fungování systému uvede také, s jakými technologiemi integračních platforem a správy API služeb funguje jím dodané otevřené rozhraní.;Požadavek na dokumentaci;4.6;Návrh;;Vzorové požadavky na OS otevřenost;51406;Požadavek na dokumentaci 4.6: Do seznamu technologií uvést potřebné technologie pro integraci;| Požadavek na dokumentaci 4.6: Do seznamu technologií uvést potřebné technologie pro integraci | Dodavatel v rámci seznamu využitých technologií a technologií potřebných pro provoz a fungování systému uvede také, s jakými technologiemi integračních platforem a správy API služeb funguje jím dodané otevřené rozhraní. |
Otevřená integrace;;Skupina;3;Schváleno;;Vzorové požadavky na OS otevřenost;51300;Skupina 3: Otevřená integrace;| Skupina 3: Otevřená integrace |  |
Integrace součástí dodávky;Součástí dodávaného řešení či informačního systému je také vytvoření a dodání rozhraní pro jeho integraci s ostatními systémy. Toto rozhraní pro integraci musí splňovat zde uvedené požadavky na něj kladené.;Funkční požadavek;3.1;Schváleno;;Vzorové požadavky na OS otevřenost;51301;Funkční požadavek 3.1: Integrace součástí dodávky;| Funkční požadavek 3.1: Integrace součástí dodávky | Součástí dodávaného řešení či informačního systému je také vytvoření a dodání rozhraní pro jeho integraci s ostatními systémy. Toto rozhraní pro integraci musí splňovat zde uvedené požadavky na něj kladené. |
Systém musí mít otevřené a zdokumentované rozhraní pro integraci;Poptávaný systém musí mít jediné rozhraní pro integraci s ostatními informačními systémy podporující otevřené standardy pro integrační platformy. Rozhraní bude transparentně zdokumentováno a popsáno tak, aby zadavatel i ostatní dodavatelé jej mohli volat a využívat bez nutnosti další součinnosti s dodavatelem. ;Funkční požadavek;3.2;Schváleno;;Vzorové požadavky na OS otevřenost;51302;Funkční požadavek 3.2: Systém musí mít otevřené a zdokumentované rozhraní pro integraci;| Funkční požadavek 3.2: Systém musí mít otevřené a zdokumentované rozhraní pro integraci | Poptávaný systém musí mít jediné rozhraní pro integraci s ostatními informačními systémy podporující otevřené standardy pro integrační platformy. Rozhraní bude transparentně zdokumentováno a popsáno tak, aby zadavatel i ostatní dodavatelé jej mohli volat a využívat bez nutnosti další součinnosti s dodavatelem.  |
Rozhraní pro integraci se systémem musí umožňovat doplňování či úpravu služeb;Integrační rozhraní systému musí být koncipováno takovým způsobem, aby zadavatel či jím pověřená třetí strana byli schopni rozšiřovat integraci o nové služby. Z popisu rozhraní musí být jasný i postup, jak případně upravovat atributy či volání stávajících služeb, pokud to bude nutné.;Funkční požadavek;3.3;Schváleno;;Vzorové požadavky na OS otevřenost;51303;Funkční požadavek 3.3: Rozhraní pro integraci se systémem musí umožňovat doplňování či úpravu služeb;| Funkční požadavek 3.3: Rozhraní pro integraci se systémem musí umožňovat doplňování či úpravu služeb | Integrační rozhraní systému musí být koncipováno takovým způsobem, aby zadavatel či jím pověřená třetí strana byli schopni rozšiřovat integraci o nové služby. Z popisu rozhraní musí být jasný i postup, jak případně upravovat atributy či volání stávajících služeb, pokud to bude nutné. |
Rozhraní pro integraci služeb musí být postaveno na transparentních službách;Rozhraní pro integraci musí být tvořeno jako standardizované rozhraní složené z volatelných služeb rozdělených pro synchronní a asynchronní komunikaci. Dodavatel postaví rozhraní buď na webových službách a nebo službách API, přičemž využije obecně známých otevřených standardů pro konstrukci takových služeb a jejich schémat.;Technický požadavek;3.4;Schváleno;;Vzorové požadavky na OS otevřenost;51304;Technický požadavek 3.4: Rozhraní pro integraci služeb musí být postaveno na transparentních službách;| Technický požadavek 3.4: Rozhraní pro integraci služeb musí být postaveno na transparentních službách | Rozhraní pro integraci musí být tvořeno jako standardizované rozhraní složené z volatelných služeb rozdělených pro synchronní a asynchronní komunikaci. Dodavatel postaví rozhraní buď na webových službách a nebo službách API, přičemž využije obecně známých otevřených standardů pro konstrukci takových služeb a jejich schémat. |
Neomezené využití integračního rozhraní;Dodavatel nebude vyžadovat nákup licence na využívání integračního rozhraní a rozsah jeho využívání nebude podmiňovat licenčními či jinými poplatky. Dodavatel nebude vyžadovat ani žádné zvláštní poplatky za připojení jednotlivých informačních systémů k jím dodanému rozhraní pro integraci. Rozhraní smí zadavatel využívat pro neomezený počet systémů, neomezený počet služeb a neomezený počet jejich volání.;Technický požadavek;3.5;Schváleno;;Vzorové požadavky na OS otevřenost;51305;Technický požadavek 3.5: Neomezené využití integračního rozhraní;| Technický požadavek 3.5: Neomezené využití integračního rozhraní | Dodavatel nebude vyžadovat nákup licence na využívání integračního rozhraní a rozsah jeho využívání nebude podmiňovat licenčními či jinými poplatky. Dodavatel nebude vyžadovat ani žádné zvláštní poplatky za připojení jednotlivých informačních systémů k jím dodanému rozhraní pro integraci. Rozhraní smí zadavatel využívat pro neomezený počet systémů, neomezený počet služeb a neomezený počet jejich volání. |
Připravenost řešení na rozšíření integrace;Dodávaný systém musí být koncipován a v dokumentaci popsán takovým způsobem, aby zadavatel či jím pověřená třetí strana byli schopni nad údaji a funkcionalitami budovat nové či rozšiřovat stávající služby rozhraní pro integraci.;Technický požadavek;3.6;Schváleno;;Vzorové požadavky na OS otevřenost;51306;Technický požadavek 3.6: Připravenost řešení na rozšíření integrace;| Technický požadavek 3.6: Připravenost řešení na rozšíření integrace | Dodávaný systém musí být koncipován a v dokumentaci popsán takovým způsobem, aby zadavatel či jím pověřená třetí strana byli schopni nad údaji a funkcionalitami budovat nové či rozšiřovat stávající služby rozhraní pro integraci. |
Rozhraní koncipované dle principu technologické neutrality;Dodavatel splní povinnost podle architektonického principu IKČR č. 14 u rozhraní, a to tak, že rozhraní vybuduje na otevřených standardech a nebude jej omezovat pouze na uzavřenou technologii integrační platformy, ledaže by se se zadavatelem dohodl na přechodném období, po které bude zadavatel dále využívat uzavřenou technologii uzavřené platformy, která ještě není postavena na otevřeném řešení.;Technický požadavek;3.7;Schváleno;;Vzorové požadavky na OS otevřenost;51307;Technický požadavek 3.7: Rozhraní koncipované dle principu technologické neutrality;| Technický požadavek 3.7: Rozhraní koncipované dle principu technologické neutrality | Dodavatel splní povinnost podle architektonického principu IKČR č. 14 u rozhraní, a to tak, že rozhraní vybuduje na otevřených standardech a nebude jej omezovat pouze na uzavřenou technologii integrační platformy, ledaže by se se zadavatelem dohodl na přechodném období, po které bude zadavatel dále využívat uzavřenou technologii uzavřené platformy, která ještě není postavena na otevřeném řešení. |
Dokumentace standardizace integračního rozhraní;Dodavatel v rámci předání dokumentace k využívaným technologiím doplní také seznam a případná licenční omezení u technologií využitých pro fungování rozhraní pro integraci se systémem.;Požadavek na dokumentaci;4.7;Schváleno;;Vzorové požadavky na OS otevřenost;51407;Požadavek na dokumentaci 4.7: Dokumentace standardizace integračního rozhraní;| Požadavek na dokumentaci 4.7: Dokumentace standardizace integračního rozhraní | Dodavatel v rámci předání dokumentace k využívaným technologiím doplní také seznam a případná licenční omezení u technologií využitých pro fungování rozhraní pro integraci se systémem. |
