Požadavek;Popis;Druh;Kód;Status;Verze;Modely;SortID;Úplný název;Řádek tabulky
Tvorba a správa zdrojového kódu se řídí politikou NÚKIB Bezpečnostní doporučení pro vývoj otevřeného softwaru ve veřejné správě;"Při tvorbě zdrojového kódu; jeho správě a přípravě a nasazování řešení se dodrží opatření v metodice Bezpečnostní doporučení pro vývoj otevřeného softwaru ve veřejné správě alespoň ve skupinách , D, CI.";Technický požadavek;;;;Vzorové požadavky na OS otevřenost;51203;Technický požadavek : Tvorba a správa zdrojového kódu se řídí politikou NÚKIB Bezpečnostní doporučení pro vývoj otevřeného softwaru ve veřejné správě;"| Technický požadavek : Tvorba a správa zdrojového kódu se řídí politikou NÚKIB Bezpečnostní doporučení pro vývoj otevřeného softwaru ve veřejné správě | Při tvorbě zdrojového kódu; jeho správě a přípravě a nasazování řešení se dodrží opatření v metodice Bezpečnostní doporučení pro vývoj otevřeného softwaru ve veřejné správě alespoň ve skupinách S; D; CI;Technický požadavek;;;;;;;;;;;;;;;;;;;;;;Při tvorbě a správě zdrojového kódu a jeho verzování a testování a při nasazení řešení se dodržují opatření uvedená v Bezpečnostní doporučení pro vývoj otevřeného softwaru ve veřejné správě metodice alespoň ve skupinách S, D a CI |"
Aplikace a knihovny jsou řádně v kódu deklarovány a používají určené závislosti;Jsou-li v řešení využity externí aplikace či knihovny třetích stran, jsou jejich závislosti v kódu správně deklarovány a je popsána jejich potřeba a účel knihovny. U knihoven dodavatele se veškeré zde uvedené požadavky na otevřenost uplatní vždy a bez výjimek, u knihoven třetích stran jež nejsou otevřené se uplatní požadavky v maximální možné míře.;Technický požadavek;;;;Vzorové požadavky na OS otevřenost;51204;Technický požadavek : Aplikace a knihovny jsou řádně v kódu deklarovány a používají určené závislosti;"| Technický požadavek : Aplikace a knihovny jsou řádně v kódu deklarovány a používají určené závislosti | Potřebuje-li poptávané řešení ke svému fungování externí aplikaci;Jsou-li v řešení využity externí aplikace či knihovny třetích stran, jsou jejich závislosti v kódu správně deklarovány a je popsána jejich potřeba a účel knihovny. U knihoven dodavatele se veškeré zde uvedené požadavky na otevřenost uplatní vždy a bez výjimek, u knihoven třetích stran jež nejsou otevřené se uplatní požadavky v maximální možné míře. |"
Využívají se pouze aktuální, podporované a udržované verze knihoven a aplikací;Pokud je využita externí závislost, musí být použity pouze knihovny a jejich verze, které jsou udržované, aby bylo sníženo riziko použití knihovny, která obsahuje zranitelnosti, které nikdo nebude řešit. Pokud aplikace závisí na neudržované knihovně, měla by být nahrazena novější, podporovanou verzí nebo její udržovanou alternativou.;Technický požadavek;;;;Vzorové požadavky na OS otevřenost;51205;Technický požadavek : Využívají se pouze aktuální, podporované a udržované verze knihoven a aplikací;| Technický požadavek : Využívají se pouze aktuální, podporované a udržované verze knihoven a aplikací | Pokud je využita externí závislost, musí být použity pouze knihovny a jejich verze, které jsou udržované, aby bylo sníženo riziko použití knihovny, která obsahuje zranitelnosti, které nikdo nebude řešit. Pokud aplikace závisí na neudržované knihovně, měla by být nahrazena novější, podporovanou verzí nebo její udržovanou alternativou. |
Vzorové požadavky na zakázky ICT v souvislosti s otevřeným řešením a open-source;;Díl;;Návrh;1;Vzorové požadavky na OS otevřenost;51000;Díl : Vzorové požadavky na zakázky ICT v souvislosti s otevřeným řešením a open-source;| Díl : Vzorové požadavky na zakázky ICT v souvislosti s otevřeným řešením a open-source |  |
Právní požadavky a požadavky na vztah k dodávce a dodavateli ;;Skupina;1;Návrh;1;Vzorové požadavky na OS otevřenost;51100;Skupina 1: Právní požadavky a požadavky na vztah k dodávce a dodavateli ;| Skupina 1: Právní požadavky a požadavky na vztah k dodávce a dodavateli  |  |
Deklarace a popis otevřenosti řešení;Dodavatel, již v nabídce smlouvy určené zadavateli, pak i při uzavírání smluvního vztahu se zadavatelem, přesně deklaruje, jaká je skutečná míra otevřenosti řešení dodávaného díla. Dodavatel ve smlouvě přesně říká, jestli je dílo postavené na open-source řešení a také uvádí to, jestli je součástí dodávky i zdrojový kód díla či nikoliv. Dodavatel též ve smlouvě deklaruje, že dodané dílo / systém zadavateli bude dodáno tak, aby ten měl vždy možnost nechat jej spravovat a rozvíjet třetí stranou, tedy naprosto nezávisle na samotném dodavateli díla.;Právní požadavek;1.1;Návrh;1;Vzorové požadavky na OS otevřenost;51101;Právní požadavek 1.1: Deklarace a popis otevřenosti řešení;| Právní požadavek 1.1: Deklarace a popis otevřenosti řešení | Dodavatel, již v nabídce smlouvy určené zadavateli, pak i při uzavírání smluvního vztahu se zadavatelem, přesně deklaruje, jaká je skutečná míra otevřenosti řešení dodávaného díla. Dodavatel ve smlouvě přesně říká, jestli je dílo postavené na open-source řešení a také uvádí to, jestli je součástí dodávky i zdrojový kód díla či nikoliv. Dodavatel též ve smlouvě deklaruje, že dodané dílo / systém zadavateli bude dodáno tak, aby ten měl vždy možnost nechat jej spravovat a rozvíjet třetí stranou, tedy naprosto nezávisle na samotném dodavateli díla. |
Práva na zajištění provozu třetí stranou;Dodavatel předá zadavateli veškerá práva vztahující se k dodávanému dílu tak, aby zadavatel měl možnost dílo plně provozovat či samotný provoz a správu díla a jeho rozvoj předat subjektu třetí strany.;Právní požadavek;1.2;Návrh;1;Vzorové požadavky na OS otevřenost;51102;Právní požadavek 1.2: Práva na zajištění provozu třetí stranou;| Právní požadavek 1.2: Práva na zajištění provozu třetí stranou | Dodavatel předá zadavateli veškerá práva vztahující se k dodávanému dílu tak, aby zadavatel měl možnost dílo plně provozovat či samotný provoz a správu díla a jeho rozvoj předat subjektu třetí strany. |
Právo na zajištění podpory třetí stranou;Dodavatel předá zadavateli veškerá práva k dílu se vztahující tak, aby zadavatel měl plnou možnost zajistit technickou a uživatelskou podporu informačního systému přímo svými prostředky či, aby  zadavatel měl možnost tuto technickou a uživatelskou podporu informačního systému delegovat na subjekt třetí strany.;Právní požadavek;1.3;Návrh;1;Vzorové požadavky na OS otevřenost;51103;Právní požadavek 1.3: Právo na zajištění podpory třetí stranou;| Právní požadavek 1.3: Právo na zajištění podpory třetí stranou | Dodavatel předá zadavateli veškerá práva k dílu se vztahující tak, aby zadavatel měl plnou možnost zajistit technickou a uživatelskou podporu informačního systému přímo svými prostředky či, aby  zadavatel měl možnost tuto technickou a uživatelskou podporu informačního systému delegovat na subjekt třetí strany. |
Práva na zajištění rozvoje třetí stranou;Dodavatel předá zadavateli veškerá práva k dílu se vztahující tak, aby zadavatel měl maximální možnost zajistit rozvoj informačního systému přímo svými prostředky či, aby  zadavatel měl možnost rozvoj informačního systému delegovat na subjekt třetí strany.;Právní požadavek;1.4;Návrh;1;Vzorové požadavky na OS otevřenost;51104;Právní požadavek 1.4: Práva na zajištění rozvoje třetí stranou;| Právní požadavek 1.4: Práva na zajištění rozvoje třetí stranou | Dodavatel předá zadavateli veškerá práva k dílu se vztahující tak, aby zadavatel měl maximální možnost zajistit rozvoj informačního systému přímo svými prostředky či, aby  zadavatel měl možnost rozvoj informačního systému delegovat na subjekt třetí strany. |
Podrobné odůvodnění pro výjimky ze zásad IKČR č. 16 a 17, pokud jsou relevantní;Zadavatel, pro požadované dílo, je povinen naplnit soulad s Informační koncepcí ČR, hlavně se zásadami č. 16 a č. 17 této koncepce. Jestliže však není možné tyto zásady IKČR zadavatelem naplnit, je nezbytné, aby dodavatel poskytnul zadavateli podklady pro případné odůvodnění pro vyjímku ze zásad č. 16 a 17 IKČR, a to kupříkladu tehdy, kdy dodavatel nemůže předat zadavateli autorská práva ke komponentám třetích stran. Na základě výše uvedeného je zadavatel schopen požádat o vyjímku při plnění souladu se zásadami č. 16. a č. 17 IKČR.;Právní požadavek;1.5;Návrh;1;Vzorové požadavky na OS otevřenost;51105;Právní požadavek 1.5: Podrobné odůvodnění pro výjimky ze zásad IKČR č. 16 a 17, pokud jsou relevantní;| Právní požadavek 1.5: Podrobné odůvodnění pro výjimky ze zásad IKČR č. 16 a 17, pokud jsou relevantní | Zadavatel, pro požadované dílo, je povinen naplnit soulad s Informační koncepcí ČR, hlavně se zásadami č. 16 a č. 17 této koncepce. Jestliže však není možné tyto zásady IKČR zadavatelem naplnit, je nezbytné, aby dodavatel poskytnul zadavateli podklady pro případné odůvodnění pro vyjímku ze zásad č. 16 a 17 IKČR, a to kupříkladu tehdy, kdy dodavatel nemůže předat zadavateli autorská práva ke komponentám třetích stran. Na základě výše uvedeného je zadavatel schopen požádat o vyjímku při plnění souladu se zásadami č. 16. a č. 17 IKČR. |
Práva na obsah dodávky;Dodavatel předá zadavateli veškerá práva na všechny části dodávky včetně kompletní dokumentace, včetně analytických prací a návrhů řešení, také včetně samotné architektury dodávaného díla, a to proto, aby zadavatel měl tyto prostředky k dispozici i po případné rozluce obou stran.;Právní požadavek;1.6;Návrh;1;Vzorové požadavky na OS otevřenost;51106;Právní požadavek 1.6: Práva na obsah dodávky;| Právní požadavek 1.6: Práva na obsah dodávky | Dodavatel předá zadavateli veškerá práva na všechny části dodávky včetně kompletní dokumentace, včetně analytických prací a návrhů řešení, také včetně samotné architektury dodávaného díla, a to proto, aby zadavatel měl tyto prostředky k dispozici i po případné rozluce obou stran. |
Práva na zdrojové kódy a dokumentaci;Dodavatel předá zadavateli zdrojové kódy, a to včetně jejich popisu, ke všem komponentám díla. Pochopitelně  za předpokladu, že těmito kódy disponuje. V případě, že se jedná o zdrojové kódy open-source řešení, předá dodavatel zadavateli zdroj / odkaz, který na tyto veřejné kódy odkazuje. Kromě zdrojových kódů předává dodavatel zadavateli i kompletní vývojovou dokumentaci. Vývojová dokumentace a zdrojové kódy musejí být předány v takovém rozsahu a detailu, aby bylo možné na základě tohoto předání zajistit plnou podporu a rozvoj díla buď přímo zadavatelem či subjektem třetí strany.;Právní požadavek;1.7;Návrh;1;Vzorové požadavky na OS otevřenost;51107;Právní požadavek 1.7: Práva na zdrojové kódy a dokumentaci;| Právní požadavek 1.7: Práva na zdrojové kódy a dokumentaci | Dodavatel předá zadavateli zdrojové kódy, a to včetně jejich popisu, ke všem komponentám díla. Pochopitelně  za předpokladu, že těmito kódy disponuje. V případě, že se jedná o zdrojové kódy open-source řešení, předá dodavatel zadavateli zdroj / odkaz, který na tyto veřejné kódy odkazuje. Kromě zdrojových kódů předává dodavatel zadavateli i kompletní vývojovou dokumentaci. Vývojová dokumentace a zdrojové kódy musejí být předány v takovém rozsahu a detailu, aby bylo možné na základě tohoto předání zajistit plnou podporu a rozvoj díla buď přímo zadavatelem či subjektem třetí strany. |
Práva na BI v rámci dodávky;Dodavatel předá zadavateli veškerá práva byznys inteligence, prostřednictvím které se realizuje příslušný informační systém / dílo. Ve vlastnictví zadavatele tak zůstává, a to i v případě rozluky těchto dvou subjektů, samotný obsah, kód díla i jeho kompletní dokumentace a také právě tzv byznys inteligence, která popisuje vše, co informační systém / dílo vlastně dělá a jak funguje. Zadavatel musí v tomto ohledu obdržet tedy veškeré informace popisující komplexní fungování systému / díla a také maximální penzum informací, jaké jsou potřeby pro jeho správu.;Právní požadavek;1.8;Návrh;1;Vzorové požadavky na OS otevřenost;51108;Právní požadavek 1.8: Práva na BI v rámci dodávky;| Právní požadavek 1.8: Práva na BI v rámci dodávky | Dodavatel předá zadavateli veškerá práva byznys inteligence, prostřednictvím které se realizuje příslušný informační systém / dílo. Ve vlastnictví zadavatele tak zůstává, a to i v případě rozluky těchto dvou subjektů, samotný obsah, kód díla i jeho kompletní dokumentace a také právě tzv byznys inteligence, která popisuje vše, co informační systém / dílo vlastně dělá a jak funguje. Zadavatel musí v tomto ohledu obdržet tedy veškeré informace popisující komplexní fungování systému / díla a také maximální penzum informací, jaké jsou potřeby pro jeho správu. |
Práva na dílo zůstávají zadavateli i po ukončení vztahu s dodavatelem;Práva na samotné zdrojové kódy díla, práva na úpravu a rozvoj díla, práva na kompletní dokumentaci vztahující se k dodanému dílu se předávají zadavateli trvale. Tato práva zadavatele v žádném případě nezanikají v okamžiku ukončení smluvního vztahu zadavatele a dodavatele.;Právní požadavek;1.9;Návrh;1;Vzorové požadavky na OS otevřenost;51109;Právní požadavek 1.9: Práva na dílo zůstávají zadavateli i po ukončení vztahu s dodavatelem;| Právní požadavek 1.9: Práva na dílo zůstávají zadavateli i po ukončení vztahu s dodavatelem | Práva na samotné zdrojové kódy díla, práva na úpravu a rozvoj díla, práva na kompletní dokumentaci vztahující se k dodanému dílu se předávají zadavateli trvale. Tato práva zadavatele v žádném případě nezanikají v okamžiku ukončení smluvního vztahu zadavatele a dodavatele. |
Návrh smlouvy musí respektovat možnost provozu a rozvoje třetí stranou;Dodavatel již v rámci nabídky předloží návrh smlouvy, která respektuje veškerá zde uvedená práva zadavatele a povinnosti dodavatele v právních a znalostních požadavcích. Dodavatel v rámci nabídky předloží dokument či přehled plnění jednotlivých požadavků s odkazem na konkrétní ustanovení v návrhu smlouvy.;Právní požadavek;1.10;Návrh;1;Vzorové požadavky na OS otevřenost;51110;Právní požadavek 1.10: Návrh smlouvy musí respektovat možnost provozu a rozvoje třetí stranou;| Právní požadavek 1.10: Návrh smlouvy musí respektovat možnost provozu a rozvoje třetí stranou | Dodavatel již v rámci nabídky předloží návrh smlouvy, která respektuje veškerá zde uvedená práva zadavatele a povinnosti dodavatele v právních a znalostních požadavcích. Dodavatel v rámci nabídky předloží dokument či přehled plnění jednotlivých požadavků s odkazem na konkrétní ustanovení v návrhu smlouvy. |
Integrační rozhraní neomezené licencí či podmínkami využití;Dodavatel žádným způsobem nezpůsobí to, aby zadavatel nemohl využívat služby rozhraní integrace se systémem bez nutnosti dalších licenčních poplatků dodavateli nebo dalších nákladů na pořízení technologie potřebné pro fungování těchto služeb. Za to se nepovažuje nákup technologie určené jako integrační platforma pokud zadavatel nevyužívá integrační platformu postavenou na opensource.;Právní požadavek;1.11;Návrh;1;Vzorové požadavky na OS otevřenost;51111;Právní požadavek 1.11: Integrační rozhraní neomezené licencí či podmínkami využití;| Právní požadavek 1.11: Integrační rozhraní neomezené licencí či podmínkami využití | Dodavatel žádným způsobem nezpůsobí to, aby zadavatel nemohl využívat služby rozhraní integrace se systémem bez nutnosti dalších licenčních poplatků dodavateli nebo dalších nákladů na pořízení technologie potřebné pro fungování těchto služeb. Za to se nepovažuje nákup technologie určené jako integrační platforma pokud zadavatel nevyužívá integrační platformu postavenou na opensource. |
Technické a funkční a nefunkční požadavky na technickou realizaci díla ;;Skupina;2;Návrh;;Vzorové požadavky na OS otevřenost;51200;Skupina 2: Technické a funkční a nefunkční požadavky na technickou realizaci díla ;| Skupina 2: Technické a funkční a nefunkční požadavky na technickou realizaci díla  |  |
Poptávané řešení bude vystavěno na open-source platformách;Je-li k řádnému fungování sogtwarového řešení zapotřebí nějaká sdílená komponeta, či platforma, bude pro vývoj a provoz využita platforma s otevřeným zdrojovým kódem a to buď v bezplatné verzi, nebo v placené rozšířené verzi s odůvodněním takové potřeby.;Technický požadavek;;Návrh;;Vzorové požadavky na OS otevřenost;51201;Technický požadavek : Poptávané řešení bude vystavěno na open-source platformách;| Technický požadavek : Poptávané řešení bude vystavěno na open-source platformách | Je-li k řádnému fungování sogtwarového řešení zapotřebí nějaká sdílená komponeta, či platforma, bude pro vývoj a provoz využita platforma s otevřeným zdrojovým kódem a to buď v bezplatné verzi, nebo v placené rozšířené verzi s odůvodněním takové potřeby. |
Poptávané řešení bude postaveno na open-source produktech;Je-li k řádnému fungování sogtwarového řešení zapotřebí nějaký softwarový produkt, bude pro vývoj a provoz produkt s otevřeným zdrojovým kódem a to buď v bezplatné verzi, nebo v placené rozšířené verzi s odůvodněním takové potřeby.;Technický požadavek;;Návrh;;Vzorové požadavky na OS otevřenost;51202;Technický požadavek : Poptávané řešení bude postaveno na open-source produktech;| Technický požadavek : Poptávané řešení bude postaveno na open-source produktech | Je-li k řádnému fungování sogtwarového řešení zapotřebí nějaký softwarový produkt, bude pro vývoj a provoz produkt s otevřeným zdrojovým kódem a to buď v bezplatné verzi, nebo v placené rozšířené verzi s odůvodněním takové potřeby. |
Znalostní požadavky na dokumentaci a zdroje ;;Skupina;4;Návrh;;Vzorové požadavky na OS otevřenost;51400;Skupina 4: Znalostní požadavky na dokumentaci a zdroje ;| Skupina 4: Znalostní požadavky na dokumentaci a zdroje  |  |
Dodat přehled veškerých produktů a součástí jež dodávka obsahuje;Dodavatel již v rámci nabídky, nebo nejpozději při schvalování detailního návrhu řešení, dodá seznam všech součástí a zejména technologických platforem a prostředků pro dodávané řešení. Tento seznam musí obsahovat zejména technologické a aplikační platformy na nichž je řešení vystavěno a na jejichž existenci je záviské a to včetně označení jejich verzí nutných pro chod řešení a minimální požadované konfigurace pro správný chod řešení. Dodavatel dodá také seznam součástí a platforem pro vývojové prostředí a nebo rozvoj programového kódu.;Požadavek na dokumentaci;4.1;Návrh;;Vzorové požadavky na OS otevřenost;51401;Požadavek na dokumentaci 4.1: Dodat přehled veškerých produktů a součástí jež dodávka obsahuje;| Požadavek na dokumentaci 4.1: Dodat přehled veškerých produktů a součástí jež dodávka obsahuje | Dodavatel již v rámci nabídky, nebo nejpozději při schvalování detailního návrhu řešení, dodá seznam všech součástí a zejména technologických platforem a prostředků pro dodávané řešení. Tento seznam musí obsahovat zejména technologické a aplikační platformy na nichž je řešení vystavěno a na jejichž existenci je záviské a to včetně označení jejich verzí nutných pro chod řešení a minimální požadované konfigurace pro správný chod řešení. Dodavatel dodá také seznam součástí a platforem pro vývojové prostředí a nebo rozvoj programového kódu. |
Dodat veškeré licenční smlouvy produktů a součástí jež dodávka obsahuje;Dodavatel nejpozději při akceptačním řízení dodá veškeré licence a licenční podmínky nejen pro samotné řešení, ale také pro všechny jeho licencované součastí a platformy. Dodá buď úplné znění licenční smlouvy a dalších smluvních dokumentů, jimiž je zadavatel povinen se řídit při provozu a rozvoji a nebo odkaz na aktuální verze takových dokumentů, pokud jsou veřejně k dispozici na internetu.;Požadavek na dokumentaci;4.2;Návrh;;Vzorové požadavky na OS otevřenost;51402;Požadavek na dokumentaci 4.2: Dodat veškeré licenční smlouvy produktů a součástí jež dodávka obsahuje;| Požadavek na dokumentaci 4.2: Dodat veškeré licenční smlouvy produktů a součástí jež dodávka obsahuje | Dodavatel nejpozději při akceptačním řízení dodá veškeré licence a licenční podmínky nejen pro samotné řešení, ale také pro všechny jeho licencované součastí a platformy. Dodá buď úplné znění licenční smlouvy a dalších smluvních dokumentů, jimiž je zadavatel povinen se řídit při provozu a rozvoji a nebo odkaz na aktuální verze takových dokumentů, pokud jsou veřejně k dispozici na internetu. |
Dodat veškeré zdrojové kódy včetně dokumentace;Dodavatel u  otevřených produktů a součástí a u součástí kde tomu nebrání autorské právo nezaviněné hlavním dodavatelem dodá zdrojové kódy včetně dokumentace. Součástí dokumentace jsou i vazby na potřebné produkty a součásti třetích stran a způsob jejich využití ve zdrojovém kódu a při kompilaci.;Požadavek na dokumentaci;4.3;Návrh;;Vzorové požadavky na OS otevřenost;51403;Požadavek na dokumentaci 4.3: Dodat veškeré zdrojové kódy včetně dokumentace;| Požadavek na dokumentaci 4.3: Dodat veškeré zdrojové kódy včetně dokumentace | Dodavatel u  otevřených produktů a součástí a u součástí kde tomu nebrání autorské právo nezaviněné hlavním dodavatelem dodá zdrojové kódy včetně dokumentace. Součástí dokumentace jsou i vazby na potřebné produkty a součásti třetích stran a způsob jejich využití ve zdrojovém kódu a při kompilaci. |
Datová architektura a dokumentace datového fondu řešení;Dodavatel v rámci dodávky řešení dodá model datové architektury v úrovni a podrobnosti podle hledisek datové architektury z Národního architektonického rámce a to v úrovni všech skupin údajů, jednotlivćh údajů a jejich evidencí a technických podrobnostech o údajích srovnatelných se způsobem a obsahem ohláění údajů v r'mci agend v RPP.;Požadavek na dokumentaci;4.4;Návrh;;Vzorové požadavky na OS otevřenost;51404;Požadavek na dokumentaci 4.4: Datová architektura a dokumentace datového fondu řešení;| Požadavek na dokumentaci 4.4: Datová architektura a dokumentace datového fondu řešení | Dodavatel v rámci dodávky řešení dodá model datové architektury v úrovni a podrobnosti podle hledisek datové architektury z Národního architektonického rámce a to v úrovni všech skupin údajů, jednotlivćh údajů a jejich evidencí a technických podrobnostech o údajích srovnatelných se způsobem a obsahem ohláění údajů v r'mci agend v RPP. |
Dokumentace a popis rozhraní k integraci;Dodavatel v rámci předané dokumentace předá také úplnou dokumentaci rozhraní systému určeného pro integraci s ostatními informačními systémy. Tato dokumentace bude obsahovat zejména technologický popis fungování rozhraní, rozdělení služeb na synchronní a asynchronní, popisy všech služeb rozhraní, schémata jednotlivých služeb a seznamů jejich atributů včetně příslušných omezení, seznam a popis všech vrácených chybových hlášení a zpráv včetně popisu odstranění příčiny chyby a datová schémata atributů pro volání služeb v rámci webových služeb nebo služeb API.;Požadavek na dokumentaci;4.5;Návrh;;Vzorové požadavky na OS otevřenost;51405;Požadavek na dokumentaci 4.5: Dokumentace a popis rozhraní k integraci;| Požadavek na dokumentaci 4.5: Dokumentace a popis rozhraní k integraci | Dodavatel v rámci předané dokumentace předá také úplnou dokumentaci rozhraní systému určeného pro integraci s ostatními informačními systémy. Tato dokumentace bude obsahovat zejména technologický popis fungování rozhraní, rozdělení služeb na synchronní a asynchronní, popisy všech služeb rozhraní, schémata jednotlivých služeb a seznamů jejich atributů včetně příslušných omezení, seznam a popis všech vrácených chybových hlášení a zpráv včetně popisu odstranění příčiny chyby a datová schémata atributů pro volání služeb v rámci webových služeb nebo služeb API. |
